{
 "task_id": "money-recon-seed4-0912",
 "objective": "Fleet money-platform recon v4: HN Algolia mining via pure shell pipeline (no python quoting). Read-only evidence for command center merge.",
 "created_by": "boyang-command",
 "shards": [
  {
   "shard_id": 1,
   "kind": "shell",
   "instructions": "curl -sm 25 'https://hn.algolia.com/api/v1/search?query=make+money+online&tags=story&hitsPerPage=12&numericFilters=points%3E80' | tr ',' '\\n' | grep -oE '\"(points|created_at|title|url)\":(\"[^\"]*\"|[0-9]+)' | sed -E 's/\"created_at\":\"([0-9]{4}-[0-9]{2}).*/date \\1/; s/\"points\":/PTS /; s/\"title\":\"/T | /; s/\"url\":\"/U | /; s/\"hit\":\\{//g'",
   "expected_output": "HN story rows",
   "timeout_seconds": 300
  },
  {
   "shard_id": 2,
   "kind": "shell",
   "instructions": "curl -sm 25 'https://hn.algolia.com/api/v1/search?query=freelance+platform&tags=story&hitsPerPage=12&numericFilters=points%3E80' | tr ',' '\\n' | grep -oE '\"(points|created_at|title|url)\":(\"[^\"]*\"|[0-9]+)' | sed -E 's/\"created_at\":\"([0-9]{4}-[0-9]{2}).*/date \\1/; s/\"points\":/PTS /; s/\"title\":\"/T | /; s/\"url\":\"/U | /; s/\"hit\":\\{//g'",
   "expected_output": "HN story rows",
   "timeout_seconds": 300
  },
  {
   "shard_id": 3,
   "kind": "shell",
   "instructions": "curl -sm 25 'https://hn.algolia.com/api/v1/search?query=side+project+revenue&tags=story&hitsPerPage=12&numericFilters=points%3E80' | tr ',' '\\n' | grep -oE '\"(points|created_at|title|url)\":(\"[^\"]*\"|[0-9]+)' | sed -E 's/\"created_at\":\"([0-9]{4}-[0-9]{2}).*/date \\1/; s/\"points\":/PTS /; s/\"title\":\"/T | /; s/\"url\":\"/U | /; s/\"hit\":\\{//g'",
   "expected_output": "HN story rows",
   "timeout_seconds": 300
  },
  {
   "shard_id": 4,
   "kind": "shell",
   "instructions": "curl -sm 25 'https://hn.algolia.com/api/v1/search?query=micro+saas+revenue&tags=story&hitsPerPage=12&numericFilters=points%3E80' | tr ',' '\\n' | grep -oE '\"(points|created_at|title|url)\":(\"[^\"]*\"|[0-9]+)' | sed -E 's/\"created_at\":\"([0-9]{4}-[0-9]{2}).*/date \\1/; s/\"points\":/PTS /; s/\"title\":\"/T | /; s/\"url\":\"/U | /; s/\"hit\":\\{//g'",
   "expected_output": "HN story rows",
   "timeout_seconds": 300
  },
  {
   "shard_id": 5,
   "kind": "shell",
   "instructions": "curl -sm 25 'https://hn.algolia.com/api/v1/search?query=data+labeling+job&tags=story&hitsPerPage=12&numericFilters=points%3E80' | tr ',' '\\n' | grep -oE '\"(points|created_at|title|url)\":(\"[^\"]*\"|[0-9]+)' | sed -E 's/\"created_at\":\"([0-9]{4}-[0-9]{2}).*/date \\1/; s/\"points\":/PTS /; s/\"title\":\"/T | /; s/\"url\":\"/U | /; s/\"hit\":\\{//g'",
   "expected_output": "HN story rows",
   "timeout_seconds": 300
  },
  {
   "shard_id": 6,
   "kind": "shell",
   "instructions": "curl -sm 25 'https://hn.algolia.com/api/v1/search?query=gpu+rental&tags=story&hitsPerPage=12&numericFilters=points%3E80' | tr ',' '\\n' | grep -oE '\"(points|created_at|title|url)\":(\"[^\"]*\"|[0-9]+)' | sed -E 's/\"created_at\":\"([0-9]{4}-[0-9]{2}).*/date \\1/; s/\"points\":/PTS /; s/\"title\":\"/T | /; s/\"url\":\"/U | /; s/\"hit\":\\{//g'",
   "expected_output": "HN story rows",
   "timeout_seconds": 300
  },
  {
   "shard_id": 7,
   "kind": "shell",
   "instructions": "curl -sm 25 'https://hn.algolia.com/api/v1/search?query=creator+economy&tags=story&hitsPerPage=12&numericFilters=points%3E80' | tr ',' '\\n' | grep -oE '\"(points|created_at|title|url)\":(\"[^\"]*\"|[0-9]+)' | sed -E 's/\"created_at\":\"([0-9]{4}-[0-9]{2}).*/date \\1/; s/\"points\":/PTS /; s/\"title\":\"/T | /; s/\"url\":\"/U | /; s/\"hit\":\\{//g'",
   "expected_output": "HN story rows",
   "timeout_seconds": 300
  },
  {
   "shard_id": 8,
   "kind": "shell",
   "instructions": "curl -sm 25 'https://hn.algolia.com/api/v1/search?query=prompt+selling&tags=story&hitsPerPage=12&numericFilters=points%3E80' | tr ',' '\\n' | grep -oE '\"(points|created_at|title|url)\":(\"[^\"]*\"|[0-9]+)' | sed -E 's/\"created_at\":\"([0-9]{4}-[0-9]{2}).*/date \\1/; s/\"points\":/PTS /; s/\"title\":\"/T | /; s/\"url\":\"/U | /; s/\"hit\":\\{//g'",
   "expected_output": "HN story rows",
   "timeout_seconds": 300
  },
  {
   "shard_id": 9,
   "kind": "shell",
   "instructions": "curl -sm 25 'https://hn.algolia.com/api/v1/search?query=stock+photos+income&tags=story&hitsPerPage=12&numericFilters=points%3E80' | tr ',' '\\n' | grep -oE '\"(points|created_at|title|url)\":(\"[^\"]*\"|[0-9]+)' | sed -E 's/\"created_at\":\"([0-9]{4}-[0-9]{2}).*/date \\1/; s/\"points\":/PTS /; s/\"title\":\"/T | /; s/\"url\":\"/U | /; s/\"hit\":\\{//g'",
   "expected_output": "HN story rows",
   "timeout_seconds": 300
  }
 ]
}