{
 "task_id": "r08c-mail-dns-smtp",
 "objective": "常态化批次C(任务书3.12): FOB线索邮箱域 DNS(MX/A/SPF)+port25 SMTP banner 批查, 8域分3片, 产出可投递性标记(450灰=对方策略非故障)",
 "created_by": "hermes-r08",
 "shards": [
  {
   "shard_id": 1,
   "kind": "shell",
   "instructions": "pip install -q dnspython && python3 scripts/r08_smtp_probe.py 163.com 126.com",
   "expected_output": "2域 mx/a/spf/port25 banner+verdict",
   "timeout_seconds": 240
  },
  {
   "shard_id": 2,
   "kind": "shell",
   "instructions": "pip install -q dnspython && python3 scripts/r08_smtp_probe.py qq.com foxmail.com aliyun.com",
   "expected_output": "3域 mx/a/spf/port25 banner+verdict",
   "timeout_seconds": 240
  },
  {
   "shard_id": 3,
   "kind": "shell",
   "instructions": "pip install -q dnspython && python3 scripts/r08_smtp_probe.py gmail.com hotmail.com fobshanghai.com",
   "expected_output": "3域 mx/a/spf/port25 banner+verdict",
   "timeout_seconds": 240
  }
 ]
}